Empresa;Nota (Estrelas);Qtd Avaliações;Resumo do Negócio (Pitch);Endereço;Telefone;Tipo;Link WhatsApp;Site;E-mail;Instagram;Facebook;LinkedIn;TikTok;YouTube
Cantina Zabot Restaurante;4.6;-;A gastronomia italiana com opções brasileiras de carnes diversas e saladas para toda a família.;Av. Leoberto Leal, 184  Barreiros, São José - SC, 88117-000;(48) 3240-0436;☎️ Fixo;-;http://www.cantinazabot.com.br/;-;-;-;-;-;-
Raulino's Restaurante;4.4;-;-;R. Altamiro Di Bernardi, 801  Campinas, São José - SC, 88101-150;(48) 3241-0828;☎️ Fixo;-;-;-;-;-;-;-;-
Moinhos Restaurante e Pizzaria;4.6;-;"2,232 seguidores, 126 seguindo, 80 posts — Moinhos Restaurante e Pizzaria (@moinhosrestaurante) no Instagram: ""• Pizzaria e Restaurante 30 anos Rua Doralice Ramos de Pinho 382 de segunda à sexta das 10:30 às 14:00 e de terça à sábado das 18:00 às 23:30""";R. Doralice Ramos Pinho, 382  Jardim Cidade de Florianopolis, São José - SC, 88111-310;(48) 3346-3194;☎️ Fixo;-;https://www.instagram.com/moinhosrestaurante;-;-;-;-;-;-
Tropilha Grill Churrascaria;4.8;-;A melhor Churrascaria em São José - Florianópolis, com carnes selecionadas e buffet rico e variado.;Rua Cassol, 850  Kobrasol, São José - SC, 88102-340;(48) 3035-5444;☎️ Fixo;-;https://www.tropilhagrillsaojose.com.br/;contato@tropilhagrillsaojose.com.br;https://www.instagram.com/tropilhagrillsaojose;https://www.facebook.com/TropilhaGrill;-;-;-
Coco Bambu Itaguaçu: Restaurante, Peixe, Camarão, Carnes, Lagosta, Salada , SC;4.9;-;Coco Bambu o melhor do Brasil é nossa especialidade.;R. Gerôncio Thives, 1079  2º Piso - Barreiros, São José - SC, 88117-900;(48) 3821-8880;☎️ Fixo;-;https://cocobambu.com/unidade/itaguacu/;-;-;-;-;-;-
